DBN,SCHOOL NAME,Num of AP Test Takers,Num of AP Total Exams Taken,Num of AP Exams Passed
01M292,HENRY STREET SCHOOL FOR INTERNATIONAL STUDIES,,,
01M458,FORSYTH SATELLITE ACADEMY,,,
01M650,CASCADES HIGH SCHOOL,,,
01M696,BARD HIGH SCHOOL EARLY COLLEGE,,,
02M047,47 THE AMERICAN SIGN LANGUAGE AND ENGLISH SECONDARY SCHOOL,,,
02M294,ESSEX STREET ACADEMY,,,
02M296,HIGH SCHOOL OF HOSPITALITY MANAGEMENT,,,
02M298,PACE HIGH SCHOOL,,,
02M313,"JAMES BALDWIN SCHOOL, THE: A SCHOOL FOR EXPEDITIONARY LEARNING",,,
02M374,GRAMERCY ARTS HIGH SCHOOL,,,
02M392,MANHATTAN BUSINESS ACADEMY,,,
02M393,BUSINESS OF SPORTS SCHOOL,,,
02M394,EMMA LAZARUS HIGH SCHOOL,,,
02M399,THE HIGH SCHOOL FOR LANGUAGE AND DIPLOMACY,,,
02M407,INSTITUTE FOR COLLABORATIVE EDUCATION,,,
02M413,SCHOOL OF THE FUTURE HIGH SCHOOL,,,
02M419,LANDMARK HIGH SCHOOL,,,
02M427,MANHATTAN ACADEMY FOR ARTS & LANGUAGE,,,
02M437,HUDSON HIGH SCHOOL OF LEARNING TECHNOLOGIES,,,
02M438,INTERNATIONAL HIGH SCHOOL AT UNION SQUARE,,,
02M440,BAYARD RUSTIN EDUCATIONAL COMPLEX,,,
02M473,WASHINGTON IRVING YABC,,,
02M500,UNITY CENTER FOR URBAN TECHNOLOGIES,,,
02M531,REPERTORY COMPANY HIGH SCHOOL FOR THEATRE ARTS,,,
02M544,INDEPENDENCE HIGH SCHOOL,,,
02M550,LIBERTY HIGH SCHOOL ACADEMY FOR NEWCOMERS,,,
02M560,HIGH SCHOOL M560 s CITY AS SCHOOL,,,
02M565,URBAN ACADEMY LABORATORY HIGH SCHOOL,,,
02M570,SATELLITE ACADEMY HIGH SCHOOL,,,
02M586,HARVEY MILK HIGH SCHOOL,,,
02M605,HUMANITIES PREPARATORY ACADEMY,,,
02M620,NORMAN THOMAS HIGH SCHOOL,,,
03M307,"URBAN ASSEMBLY SCHOOL FOR MEDIA STUDIES, THE",,,
03M402,THE URBAN ASSEMBLY SCHOOL FOR GREEN CAREERS,,,
03M404,INNOVATION DIPLOMA PLUS,,,
03M417,FRANK MCCOURT HIGH SCHOOL,,,
03M494,HIGH SCHOOL OF ARTS AND TECHNOLOGY,,,
03M505,EDWARD A. REYNOLDS WEST SIDE HIGH SCHOOL,,,
03M541,MANHATTAN / HUNTER SCIENCE HIGH SCHOOL,,,
03M577,YOUNG ADULT BOROUGH CENTER AT LOUIS D. BRANDEIS HS,,,
04M495,PARK EAST HIGH SCHOOL,,,
04M635,ACADEMY OF ENVIRONMENTAL SCIENCE SECONDARY HIGH SCHOOL,,,
05M285,HARLEM RENAISSANCE HIGH SCHOOL,,,
05M304,MOTT HALL HIGH SCHOOL,,,
05M369,URBAN ASSEMBLY SCHOOL FOR THE PERFORMING ARTS,,,
05M685,BREAD & ROSES INTEGRATED ARTS HIGH SCHOOL,,,
06M293,CITY COLLEGE ACADEMY OF THE ARTS,,,
06M423,HIGH SCHOOL FOR EXCELLENCE AND INNOVATION,,,
06M457,GEORGE WASHINGTON YABC,,,
07X321,CROTONA ACADEMY HIGH SCHOOL,,,
07X334,INTERNATIONAL COMMUNITY HIGH SCHOOL,,,
07X379,JILL CHAIFETZ TRANSFER HIGH SCHOOL,,,
07X381,BRONX HAVEN HIGH SCHOOL,,,
07X427,COMMUNITY SCHOOL FOR SOCIAL JUSTICE,,,
07X495,UNIVERSITY HEIGHTS SECONDARY SCHOOL,,,
07X547,NEW EXPLORERS HIGH SCHOOL,,,
07X600,ALFRED E. SMITH CAREER AND TECHNICAL EDUCATION HIGH SCHOOL,,,
07X655,SAMUEL GOMPERS CAREER AND TECHNICAL EDUCATION HIGH SCHOOL,,,
08X269,BRONX STUDIO SCHOOL FOR WRITERS AND ARTISTS,,,
08X282,WOMEN'S ACADEMY OF EXCELLENCE,,,
08X305,PABLO NERUDA ACADEMY FOR ARCHITECTURE AND WORLD STUDIES,,,
08X367,"ARCHIMEDES ACADEMY FOR MATH, SCIENCE AND TECHNOLOGY APPLICATIONS",,,
08X376,"ANTONIA PANTOJA PREPARATORY ACADEMY, A COLLEGE BOARD SCHOOL",,,
08X377,BRONX COMMUNITY HIGH SCHOOL,,,
08X408,HERBERT H. LEHMAN YABC,,,
08X452,BRONX GUILD,,,
08X507,STEVENSON YABC,,,
08X530,BANANA KELLY HIGH SCHOOL,,,
08X537,BRONX ARENA HIGH SCHOOL,,,
08X540,SCHOOL FOR COMMUNITY RESEARCH AND LEARNING,,,
08X560,HIGH SCHOOL X560 s BRONX ACADEMY HIGH SCHOOL,,,
08X650,JANE ADDAMS HIGH SCHOOL FOR ACADEMIC CAREERS,,,
09X227,BRONX EXPEDITIONARY LEARNING HIGH SCHOOL,,,
09X239,"URBAN ASSEMBLY ACADEMY FOR HISTORY AND CITIZENSHIP FOR YOUNG MEN, THE",,,
09X252,MOTT HALL BRONX HIGH SCHOOL,,,
09X263,VALIDUS PREPARATORY ACADEMY: AN EXPEDITIONARY LEARNING SCHOOL,,,
09X276,LEADERSHIP INSTITUTE,,,
09X297,MORRIS ACADEMY FOR COLLABORATIVE STUDIES,,,
09X324,BRONX EARLY COLLEGE ACADEMY FOR TEACHING & LEARNING,,,
09X403,BRONX INTERNATIONAL HIGH SCHOOL,,,
09X404,SCHOOL FOR EXCELLENCE,,,
09X543,HIGH SCHOOL FOR VIOLIN AND DANCE,,,
10X319,PROVIDING URBAN LEARNERS SUCCESS IN EDUCATION HIGH SCHOOL,,,
10X374,KNOWLEDGE AND POWER PREPARATORY ACADEMY INTERNATIONAL HIGH SCHOOL (KAPPA),,,
10X397,ENGLISH LANGUAGE LEARNERS AND INTERNATIONAL SUPPORT PREPARATORY ACADEMY (ELLIS),,,
10X437,FORDHAM HIGH SCHOOL FOR THE ARTS,,,
10X438,FORDHAM LEADERSHIP ACADEMY FOR BUSINESS AND TECHNOLOGY,,,
10X478,LEARNING TO WORK GED AT JOHN F. KENNEDY,,,
10X667,GRACE DODGE YABC,,,
11X249,BRONX HEALTH SCIENCES HIGH SCHOOL,,,
11X265,BRONX LAB SCHOOL,,,
11X299,ASTOR COLLEGIATE ACADEMY,,,
11X417,YOUNG ADULT BOROUGH CNTR CHRISTOPHER COLUMBUS HS,,,
11X456,LEARNING TO WORK YABC AT TRUMAN HIGH SCHOOL,,,
11X541,GLOBAL ENTERPRISE HIGH SCHOOL,,,
11X544,HIGH SCHOOL FOR CONTEMPORARY ARTS,,,
12X245,NEW DAY ACADEMY,,,
12X262,PERFORMANCE CONSERVATORY HIGH SCHOOL,,,
12X278,PEACE AND DIVERSITY ACADEMY,,,
12X428,LEARNING TO WORK YABC AT MONROE ACADEMY,,,
12X446,ARTURO A. SCHOMBURG SATELLITE ACADEMY BRONX,,,
12X479,BRONX CAREER AND COLLEGE PREPARATORY HIGH SCHOOL,,,
12X480,BRONX REGIONAL HIGH SCHOOL,,,
12X692,MONROE ACADEMY FOR VISUAL ARTS & DESIGN,,,
13K336,ACADEMY OF BUSINESS AND COMMUNITY DEVELOPMENT,,,
13K350,URBAN ASSEMBLY HIGH SCHOOL OF MUSIC AND ART,,,
13K439,BROOKLYN INTERNATIONAL HIGH SCHOOL,,,
13K509,FREEDOM ACADEMY HIGH SCHOOL,,,
13K527,URBAN ASSEMBLY INSTITUTE OF MATH AND SCIENCE FOR YOUNG WOMEN,,,
13K553,BROOKLYN ACADEMY HIGH SCHOOL,,,
13K575,BEDFORD STUYVESANT PREPARATORY HIGH SCHOOL,,,
13K616,BROOKLYN HIGH SCHOOL FOR LEADERSHIP AND COMMUNITY SERVICE,,,
13K674,"CITY POLYTECHNIC HIGH SCHOOL OF ENGINEERING, ARCHITECTURE, AND TECHNOLOGY",,,
14K322,FOUNDATIONS ACADEMY,,,
14K449,"BROOKLYN LATIN SCHOOL, THE",,,
14K454,GREEN SCHOOL: AN ACADEMY FOR ENVIRONMENTAL CAREERS,,,
14K586,LYONS COMMUNITY SCHOOL,,,
14K610,AUTOMOTIVE HIGH SCHOOL,,,
14K632,FRANCES PERKINS ACADEMY,,,
14K685,EL PUENTE ACADEMY FOR PEACE AND JUSTICE,,,
14K923,AUTOMOTIVE HIGH SCHOOL YABC,,,
15K448,BROOKLYN SECONDARY SCHOOL FOR COLLABORATIVE STUDIES,,,
15K464,PARK SLOPE COLLEGIATE,,,
15K520,PACIFIC HIGH SCHOOL,,,
15K529,WEST BROOKLYN COMMUNITY HIGH SCHOOL,,,
15K530,METROPOLITAN CORPORATE ACADEMY HIGH SCHOOL,,,
15K667,SUNSET PARK HIGH SCHOOL,,,
15K698,SOUTH BROOKLYN COMMUNITY HIGH SCHOOL,,,
16K393,FREDERICK DOUGLASS ACADEMY IV SECONDARY SCHOOL,,,
16K455,BOYS AND GIRLS HIGH SCHOOL,,,
16K594,GOTHAM PROFESSIONAL ARTS ACADEMY,,,
16K688,THE BROOKLYN ACADEMY OF GLOBAL FINANCE,,,
17K467,ERASMUS YABC,,,
17K489,W.E.B. DUBOIS ACADEMIC HIGH SCHOOL,,,
17K524,INTERNATIONAL HIGH SCHOOL AT PROSPECT HEIGHTS,,,
17K528,THE HIGH SCHOOL FOR GLOBAL CITIZENSHIP,,,
17K533,SCHOOL FOR DEMOCRACY AND LEADERSHIP,,,
17K539,HIGH SCHOOL FOR SERVICE & LEARNING AT ERASMUS,,,
17K544,INTERNATIONAL ARTS BUSINESS SCHOOL,,,
17K548,BROOKLYN SCHOOL FOR MUSIC & THEATRE,,,
17K568,BROWNSVILLE ACADEMY HIGH SCHOOL,,,
17K625,PAUL ROBESON HIGH SCHOOL,,,
17K751,ACADEMY FOR HEALTH CAREERS,,,
18K566,BROOKLYN GENERATION SCHOOL,,,
18K567,BROOKLYN THEATRE ARTS HIGH SCHOOL,,,
18K569,KURT HAHN EXPEDITIONARY LEARNING SCHOOL,,,
18K578,BROOKLYN BRIDGE ACADEMY,,,
18K589,ARTS & MEDIA PREPARATORY ACADEMY,,,
18K617,HIGH SCHOOL FOR INNOVATION IN ADVERTISING AND MEDIA,,,
18K635,OLYMPUS ACADEMY,,,
18K637,ACADEMY FOR CONSERVATION AND THE ENVIRONMENT,,,
18K673,EAST BROOKLYN COMMUNITY HIGH SCHOOL,,,
19K420,FRANKLIN K. LANE HIGH SCHOOL,,,
19K431,THOMAS JEFFERSON YABC,,,
19K502,FDNY HIGH SCHOOL FOR FIRE AND LIFE SAFETY,,,
19K507,PERFORMING ARTS AND TECHNOLOGY HIGH SCHOOL,,,
19K639,BROOKLYN LAB SCHOOL,,,
19K660,W. H. MAXWELL CAREER AND TECHNICAL EDUCATION HIGH SCHOOL,,,
20K609,THE URBAN ASSEMBLY SCHOOL FOR CRIMINAL JUSTICE,,,
20K658,FRANKLIN DELANO ROOSEVELT YABC,,,
21K337,INTERNATIONAL HIGH SCHOOL AT LAFAYETTE,,,
21K348,HIGH SCHOOL OF SPORTS MANAGEMENT,,,
21K412/21K411,ABRAHAM LINCOLN YABC/LEARNING TO WORK GED AT ABRAHAM LINCOLN,,,
21K468,KINGSBOROUGH EARLY COLLEGE SCHOOL,,,
21K559,LIFE ACADEMY HIGH SCHOOL FOR FILM AND MUSIC,,,
21K728,LIBERATION DIPLOMA PLUS,,,
22K555,BROOKLYN COLLEGE ACADEMY,,,
23K493,BROOKLYN COLLEGIATE: A COLLEGE BOARD SCHOOL,,,
23K643,BROOKLYN DEMOCRACY ACADEMY,,,
23K646,ASPIRATIONS DIPLOMA PLUS HIGH SCHOOL,,,
23K647,METROPOLITAN DIPLOMA PLUS HIGH SCHOOL,,,
24Q296,PAN AMERICAN INTERNATIONAL HIGH SCHOOL,,,
24Q299,BARD HIGH SCHOOL EARLY COLLEGE II,,,
24Q457,YOUNG ADULT BOROUGH CENTER AT ARTS AND BUSINESS HS,,,
24Q520,MIDDLE COLLEGE HIGH SCHOOL AT LAGUARDIA COMMUNITY COLLEGE,,,
24Q530,INTERNATIONAL HIGH SCHOOL AT LAGUARDIA COMMUNITY COLLEGE,,,
24Q560,"ROBERT F. WAGNER, JR. SECONDARY SCHOOL FOR ARTS AND TECHNOLOGY",,,
24Q600,QUEENS VOCATIONAL AND TECHNICAL HIGH SCHOOL,,,
24Q744,VOYAGES PREPARATORY,,,
25Q263,FLUSHING INTERNATIONAL HIGH SCHOOL,,,
25Q281,EASTsWEST SCHOOL OF INTERNATIONAL STUDIES,,,
25Q467,FLUSHING YABC,,,
25Q540,QUEENS ACADEMY HIGH SCHOOL,,,
25Q792,NORTH QUEENS COMMUNITY HIGH SCHOOL,,,
27Q302,"QUEENS HIGH SCHOOL FOR INFORMATION, RESEARCH, AND TECHNOLOGY",,,
27Q400,AUGUST MARTIN HIGH SCHOOL,,,
27Q410,BEACH CHANNEL HIGH SCHOOL,,,
28Q284,YORK EARLY COLLEGE ACADEMY,,,
28Q325,HILLSIDE ARTS & LETTERS ACADEMY,,,
28Q338,QUEENS SATELLITE HIGH SCHOOL FOR OPPORTUNITY,,,
28Q470,JAMAICA HIGH SCHOOL,,,
29Q265,EXCELSIOR PREPARATORY HIGH SCHOOL,,,
29Q326,CAMBRIA HEIGHTS ACADEMY,,,
29Q492,"MATHEMATICS, SCIENCE RESEARCH AND TECHNOLOGY MAGNET HIGH SCHOOL",,,
29Q494,"LAW, GOVERNMENT AND COMMUNITY SERVICE HIGH SCHOOL",,,
29Q496,"BUSINESS, COMPUTER APPLICATIONS & ENTREPRENEURSHIP HIGH SCHOOL",,,
29Q498,HUMANITIES & ARTS MAGNET HIGH SCHOOL,,,
30Q286,"YOUNG WOMEN'S LEADERSHIP SCHOOL, ASTORIA",,,
30Q580,BACCALAUREATE SCHOOL FOR GLOBAL EDUCATION,,,
31R470,CONCORD HIGH SCHOOL,,,
31R600,RALPH R. MCKEE CAREER AND TECHNICAL EDUCATION HIGH SCHOOL,,,
31R607,YOUNG ADULT BOROUGH CENTER AT STATEN IS TECH HS,,,
32K549,BUSHWICK SCHOOL FOR SOCIAL JUSTICE,,,
32K564,BUSHWICK COMMUNITY HIGH SCHOOL,,,
75K371,P.S. 371 s LILLIAN L. RASHKIS,,,
75M035,P.S. 035,,,
75Q256,P.S. Q256,,,
75Q811,P.S. Q811,,,
75R025,SOUTH RICHMOND HIGH SCHOOL I.S./P.S. 25,,,
75X012,P.S. X012 LEWIS AND CLARK SCHOOL,,,
75X754,J. M. RAPPORT SCHOOL CAREER DEVELOPMENT,,,
79M645,SCHOOL FOR COOPERATIVE TECHNICAL EDUCATION,,,
79Q950,GED PLUS s CITYWIDE,,,
79X490,PHOENIX ACADEMY,,,
13K430,BROOKLYN TECHNICAL HIGH SCHOOL,2516,4427,3333
10X445,BRONX HIGH SCHOOL OF SCIENCE,1598,3480,2986
02M475,STUYVESANT HIGH SCHOOL,1444,2684,2608
03M485,FIORELLO H. LAGUARDIA HIGH SCHOOL OF MUSIC & ART AND PERFORMING ARTS,923,1576,1177
26Q415,BENJAMIN N. CARDOZO HIGH SCHOOL,722,1294,873
25Q525,TOWNSEND HARRIS HIGH SCHOOL,758,1249,937
28Q440,FOREST HILLS HIGH SCHOOL,882,1235,629
22K405,MIDWOOD HIGH SCHOOL,788,1226,706
26Q430,FRANCIS LEWIS HIGH SCHOOL,819,1191,712
31R605,STATEN ISLAND TECHNICAL HIGH SCHOOL,595,1098,977
26Q495,BAYSIDE HIGH SCHOOL,734,1056,493
30Q450,LONG ISLAND CITY HIGH SCHOOL,576,1035,228
31R455,TOTTENVILLE HIGH SCHOOL,424,861,335
20K490,FORT HAMILTON HIGH SCHOOL,435,705,414
21K525,EDWARD R. MURROW HIGH SCHOOL,457,690,406
22K535,LEON M. GOLDSTEIN HIGH SCHOOL FOR THE SCIENCES,386,651,398
31R460,SUSAN E. WAGNER HIGH SCHOOL,373,589,221
17K590,MEDGAR EVERS COLLEGE PREPARATORY SCHOOL,343,588,156
01M539,"NEW EXPLORATIONS INTO SCIENCE, TECHNOLOGY AND MATH HIGH SCHOOL",306,587,323
10X440,DEWITT CLINTON HIGH SCHOOL,380,551,314
25Q460,FLUSHING HIGH SCHOOL,370,550,133
25Q425,JOHN BOWNE HIGH SCHOOL,336,548,239
21K540,JOHN DEWEY HIGH SCHOOL,278,511,253
31R450,CURTIS HIGH SCHOOL,426,510,113
28Q687,QUEENS HIGH SCHOOL FOR THE SCIENCES AT YORK COLLEGE,231,427,345
04M435,MANHATTAN CENTER FOR SCIENCE AND MATHEMATICS,311,423,263
08X405,HERBERT H. LEHMAN HIGH SCHOOL,316,395,209
24Q550,HIGH SCHOOL FOR ARTS AND BUSINESS,257,386,77
22K425,JAMES MADISON HIGH SCHOOL,263,378,215
10X696,HIGH SCHOOL OF AMERICAN STUDIES AT LEHMAN COLLEGE,253,375,320
20K445,NEW UTRECHT HIGH SCHOOL,264,362,155
31R445,PORT RICHMOND HIGH SCHOOL,210,340,86
02M400,HIGH SCHOOL FOR ENVIRONMENTAL STUDIES,224,334,215
30Q445,WILLIAM CULLEN BRYANT HIGH SCHOOL,231,326,156
28Q505,HILLCREST HIGH SCHOOL,216,317,69
02M420,HIGH SCHOOL FOR HEALTH PROFESSIONS AND HUMAN SERVICES,234,314,79
31R080,THE MICHAEL J. PETRIDES SCHOOL,174,313,45
28Q620,THOMAS A. EDISON CAREER AND TECHNICAL EDUCATION HIGH SCHOOL,221,309,114
20K505,FRANKLIN DELANO ROOSEVELT HIGH SCHOOL,216,308,173
06M540,A. PHILIP RANDOLPH CAMPUS HIGH SCHOOL,159,296,110
27Q480,JOHN ADAMS HIGH SCHOOL,221,287,57
24Q455,NEWTOWN HIGH SCHOOL,213,269,132
02M416,ELEANOR ROOSEVELT HIGH SCHOOL,183,264,223
05M692,"HIGH SCHOOL FOR MATHEMATICS, SCIENCE AND ENGINEERING AT CITY COLLEGE",196,245,202
24Q485,GROVER CLEVELAND HIGH SCHOOL,150,223,92
24Q264,ACADEMY OF FINANCE AND ENTERPRISE,135,208,36
30Q555,NEWCOMERS HIGH SCHOOL,163,203,153
13K670,BENJAMIN BANNEKER ACADEMY,146,203,82
05M499,FREDERICK DOUGLASS ACADEMY,167,202,121
02M630,ART AND DESIGN HIGH SCHOOL,166,201,74
12X478,THE CINEMA SCHOOL,85,196,15
17K600,CLARA BARTON HIGH SCHOOL,128,195,56
03M479,BEACON HIGH SCHOOL,151,187,134
31R440,NEW DORP HIGH SCHOOL,143,185,76
02M545,HIGH SCHOOL FOR DUAL LANGUAGE AND ASIAN STUDIES,105,182,141
27Q650,"HIGH SCHOOL FOR CONSTRUCTION TRADES, ENGINEERING AND ARCHITECTURE",134,180,39
30Q501,FRANK SINATRA SCHOOL OF THE ARTS HIGH SCHOOL,135,176,83
02M542,MANHATTAN BRIDGES HIGH SCHOOL,117,174,130
10X213,BRONX ENGINEERING AND TECHNOLOGY ACADEMY,113,173,15
24Q610,AVIATION CAREER & TECHNICAL EDUCATION HIGH SCHOOL,152,172,115
10X477,MARBLE HILL HIGH SCHOOL FOR INTERNATIONAL STUDIES,89,168,45
10X141,RIVERDALE / KINGSBRIDGE ACADEMY (MIDDLE SCHOOL / HIGH SCHOOL 141),123,165,103
27Q475,RICHMOND HILL HIGH SCHOOL,135,164,33
02M411,BARUCH COLLEGE CAMPUS HIGH SCHOOL,108,161,92
02M489,HIGH SCHOOL OF ECONOMICS AND FINANCE,91,161,73
30Q575,ACADEMY OF AMERICAN STUDIES,104,156,100
06M467,HIGH SCHOOL FOR LAW AND PUBLIC SERVICE,114,153,56
13K595,BEDFORD ACADEMY HIGH SCHOOL,124,152,26
25Q670,ROBERT F. KENNEDY COMMUNITY HIGH SCHOOL,95,151,43
21K410,ABRAHAM LINCOLN HIGH SCHOOL,121,149,79
02M425,LEADERSHIP AND PUBLIC SERVICE HIGH SCHOOL,116,148,40
28Q680,QUEENS GATEWAY TO HEALTH SCIENCES SECONDARY SCHOOL,115,146,67
20K485,HIGH SCHOOL OF TELECOMMUNICATION ARTS AND TECHNOLOGY,132,146,63
27Q323,SCHOLARS' ACADEMY,77,138,92
11X455,HARRY S TRUMAN HIGH SCHOOL,97,136,23
02M418,MILLENNIUM HIGH SCHOOL,121,135,103
02M300,"URBAN ASSEMBLY SCHOOL OF DESIGN AND CONSTRUCTION, THE",135,135,8
06M552,GREGORIO LUPERON HIGH SCHOOL FOR SCIENCE AND MATHEMATICS,113,134,98
11X288,COLLEGIATE INSTITUTE FOR MATH AND SCIENCE,95,134,35
02M615,CHELSEA CAREER AND TECHNICAL EDUCATION HIGH SCHOOL,68,134,27
12X271,EAST BRONX ACADEMY FOR THE FUTURE,69,130,
25Q285,WORLD JOURNALISM PREPARATORY: A COLLEGE BOARD SCHOOL,104,130,43
02M529,JACQUELINE KENNEDY ONASSIS HIGH SCHOOL,87,124,54
06M348,WASHINGTON HEIGHTS EXPEDITIONARY LEARNING SCHOOL,107,124,46
02M412,N.Y.C. LAB SCHOOL FOR COLLABORATIVE STUDIES,101,122,93
17K546,HIGH SCHOOL FOR PUBLIC SERVICE: HEROES OF TOMORROW,86,115,10
27Q308,ROBERT H. GODDARD HIGH SCHOOL OF COMMUNICATION ARTS AND TECHNOLOGY,62,112,17
10X243,WEST BRONX ACADEMY FOR THE FUTURE,77,111,14
02M520,MURRY BERGTRAUM HIGH SCHOOL FOR BUSINESS CAREERS,106,110,64
28Q310,QUEENS COLLEGIATE: A COLLEGE BOARD SCHOOL,67,110,11
02M600,THE HIGH SCHOOL OF FASHION INDUSTRIES,92,108,43
02M376,NYC ISCHOOL,80,105,20
09X260,BRONX CENTER FOR SCIENCE AND MATHEMATICS,82,101,49
29Q283,PREPARATORY ACADEMY FOR WRITERS: A COLLEGE BOARD SCHOOL,71,99,8
02M625,HIGH SCHOOL OF GRAPHIC COMMUNICATION ARTS,86,98,
14K478,"THE HIGH SCHOOL FOR ENTERPRISE, BUSINESS AND TECHNOLOGY",75,96,37
13K419,"SCIENCE SKILLS CENTER HIGH SCHOOL FOR SCIENCE, TECHNOLOGY AND THE CREATIVE ARTS",81,96,7
10X342,INTERNATIONAL SCHOOL FOR LIBERAL ARTS,90,94,74
08X293,RENAISSANCE HIGH SCHOOL FOR MUSICAL THEATER & TECHNOLOGY,70,91,36
02M580,RICHARD R. GREEN HIGH SCHOOL OF TEACHING,57,91,15
10X368,INsTECH ACADEMY (M.S. / HIGH SCHOOL 368),70,89,17
11X275,HIGH SCHOOL OF COMPUTERS AND TECHNOLOGY,57,86,
07X551,BRONX ACADEMY OF LETTERS,59,85,36
12X251,EXPLORATIONS ACADEMY,60,85,24
04M555,CENTRAL PARK EAST HIGH SCHOOL,51,82,30
10X433,HIGH SCHOOL FOR TEACHING AND THE PROFESSIONS,62,82,21
03M492,"HIGH SCHOOL FOR LAW, ADVOCACY AND COMMUNITY JUSTICE",67,78,27
02M655,LIFE SCIENCES SECONDARY SCHOOL,47,77,13
02M575,MANHATTAN COMPREHENSIVE NIGHT AND DAY HIGH SCHOOL,48,74,43
31R047,CSI HIGH SCHOOL FOR INTERNATIONAL STUDIES,66,74,26
09X505,"BRONX SCHOOL FOR LAW, GOVERNMENT AND JUSTICE",42,74,14
15K519,COBBLE HILL SCHOOL OF AMERICAN STUDIES,64,72,
30Q301,ACADEMY FOR CAREERS IN TELEVISION AND FILM,54,72,40
09X231,EAGLE ACADEMY FOR YOUNG MEN,51,71,11
19K615,TRANSIT TECH CAREER AND TECHNICAL EDUCATION HIGH SCHOOL,64,71,6
21K344,RACHEL CARSON HIGH SCHOOL FOR COASTAL STUDIES,55,71,6
24Q267,HIGH SCHOOL OF APPLIED COMMUNICATION,67,69,6
08X312,MILLENNIUM ART ACADEMY,66,68,11
14K477,SCHOOL FOR LEGAL STUDIES,53,68,10
26Q435,MARTIN VAN BUREN HIGH SCHOOL,62,68,8
24Q293,CIVIC LEADERSHIP ACADEMY,40,65,13
10X434,BELMONT PREPARATORY HIGH SCHOOL,54,65,9
10X546,BRONX THEATRE HIGH SCHOOL,55,65,8
16K498,BROOKLYN HIGH SCHOOL FOR LAW AND TECHNOLOGY,47,63,
14K488,BROOKLYN PREPARATORY HIGH SCHOOL,49,62,
09X250,EXIMIUS COLLEGE PREPARATORY ACADEMY: A COLLEGE BOARD SCHOOL,55,62,15
10X549,DISCOVERY HIGH SCHOOL,54,62,8
18K633,HIGH SCHOOL FOR MEDICAL PROFESSIONS,59,62,6
14K561,WILLIAMSBURG PREPARATORY SCHOOL,54,61,28
15K656,BROOKLYN HIGH SCHOOL OF THE ARTS,44,61,22
06M346,COMMUNITY HEALTH ACADEMY OF THE HEIGHTS,38,61,6
17K547,BROOKLYN ACADEMY OF SCIENCE AND THE ENVIRONMENT,38,60,
23K697,TEACHERS PREPARATORY HIGH SCHOOL,41,60,
01M515,LOWER EAST SIDE PREPARATORY HIGH SCHOOL,50,60,54
04M610,YOUNG WOMEN'S LEADERSHIP SCHOOL,47,60,32
02M519,TALENT UNLIMITED HIGH SCHOOL,59,59,19
03M415,WADLEIGH SECONDARY SCHOOL FOR THE PERFORMING & VISUAL ARTS,55,56,
02M408,PROFESSIONAL PERFORMING ARTS HIGH SCHOOL,50,56,28
13K483,THE URBAN ASSEMBLY SCHOOL FOR LAW AND JUSTICE,34,53,36
01M448,UNIVERSITY NEIGHBORHOOD HIGH SCHOOL,37,53,21
06M468,HIGH SCHOOL FOR HEALTH CAREERS AND SCIENCES,51,51,23
14K474,PROGRESS HIGH SCHOOL FOR PROFESSIONAL CAREERS,36,50,
15K462,SECONDARY SCHOOL FOR LAW,35,50,19
21K620,WILLIAM E. GRADY CAREER AND TECHNICAL EDUCATION HIGH SCHOOL,49,49,
03M470,LOUIS D. BRANDEIS HIGH SCHOOL,21,48,
11X542,PELHAM PREPARATORY ACADEMY,43,48,13
31R064,GAYNOR MCCOWN EXPEDITIONARY LEARNING SCHOOL,31,48,9
11X418,BRONX HIGH SCHOOL FOR THE VISUAL ARTS,38,48,7
13K499,ACORN COMMUNITY HIGH SCHOOL,37,47,
30Q502,INFORMATION TECHNOLOGY HIGH SCHOOL,46,47,17
32K403,ACADEMY FOR ENVIRONMENTAL LEADERSHIP,27,47,6
14K558,WILLIAMSBURG HIGH SCHOOL FOR ARCHITECTURE AND DESIGN,32,46,9
02M439,MANHATTAN VILLAGE ACADEMY,31,45,37
22K495,SHEEPSHEAD BAY HIGH SCHOOL,29,45,13
32K556,BUSHWICK LEADERS HIGH SCHOOL FOR ACADEMIC EXCELLENCE,39,44,19
02M414,N.Y.C. MUSEUM SCHOOL,43,43,
12X267,BRONX LATIN,43,43,
32K552,ACADEMY OF URBAN PLANNING,36,43,20
21K690,BROOKLYN STUDIO SECONDARY SCHOOL,42,43,17
32K554,ALL CITY LEADERSHIP SECONDARY SCHOOL,24,43,16
25Q252,"QUEENS SCHOOL OF INQUIRY, THE",42,42,19
07X500,HOSTOSsLINCOLN ACADEMY OF SCIENCE,23,42,15
10X442,"CELIA CRUZ BRONX HIGH SCHOOL OF MUSIC, THE",30,42,11
02M288,FOOD AND FINANCE HIGH SCHOOL,41,41,
02M305,"URBAN ASSEMBLY ACADEMY OF GOVERNMENT AND LAW, THE",31,40,20
05M670,THURGOOD MARSHALL ACADEMY FOR LEARNING AND SOCIAL CHANGE,40,40,7
06M463,HIGH SCHOOL FOR MEDIA AND COMMUNICATIONS,24,38,
08X519,"FELISA RINCON DE GAUTIER INSTITUTE FOR LAW AND PUBLIC POLICY, THE",32,38,
27Q262,CHANNEL VIEW SCHOOL FOR RESEARCH,38,38,13
02M429,LEGACY SCHOOL FOR INTEGRATED STUDIES,28,36,
10X475,JOHN F. KENNEDY HIGH SCHOOL,36,36,11
26Q566,"QUEENS HIGH SCHOOL OF TEACHING, LIBERAL ARTS AND THE SCIENCES",34,36,11
12X684,WINGS ACADEMY,27,36,8
17K382,ACADEMY FOR COLLEGE PREPARATION AND CAREER EXPLORATION: A COLLEGE BOARD SCHOOL,29,36,8
07X520,FOREIGN LANGUAGE ACADEMY OF GLOBAL STUDIES,24,35,
12X682,FANNIE LOU HAMER FREEDOM HIGH SCHOOL,35,35,9
07X670,HEALTH OPPORTUNITIES HIGH SCHOOL,34,34,13
05M367,ACADEMY FOR SOCIAL ACTION: A COLLEGE BOARD SCHOOL,21,33,
17K408,ACADEMY OF HOSPITALITY AND TOURISM,33,33,
02M303,"FACING HISTORY SCHOOL, THE",32,32,
29Q272,GEORGE WASHINGTON CARVER HIGH SCHOOL FOR THE SCIENCES,19,32,
07X548,URBAN ASSEMBLY SCHOOL FOR CAREERS IN SPORTS,27,31,
09X414,JONATHAN LEVIN HIGH SCHOOL FOR MEDIA AND COMMUNICATIONS,23,31,
11X270,ACADEMY FOR SCHOLARSHIP AND ENTREPRENEURSHIP: A COLLEGE BOARD SCHOOL,26,31,
23K514,FREDERICK DOUGLASS ACADEMY VII HIGH SCHOOL,29,31,
13K605,GEORGE WESTINGHOUSE CAREER AND TECHNICAL EDUCATION HIGH SCHOOL,28,31,9
10X268,KINGSBRIDGE INTERNATIONAL HIGH SCHOOL,30,30,
03M403,THE GLOBAL LEARNING COLLABORATIVE,30,30,21
19K683,"THE SCHOOL FOR CLASSICS: AN ACADEMY OF THINKERS, WRITERS AND PERFORMERS",24,29,
11X514,THE BRONXWOOD PREPARATORY ACADEMY,28,28,
02M316,"URBAN ASSEMBLY SCHOOL OF BUSINESS FOR YOUNG WOMEN, THE",28,28,11
02M543,NEW DESIGN HIGH SCHOOL,27,27,
15K497,SCHOOL FOR INTERNATIONAL STUDIES,26,27,
09X412,BRONX HIGH SCHOOL OF BUSINESS,27,27,6
10X439,BRONX HIGH SCHOOL FOR LAW AND COMMUNITY SERVICE,26,26,9
11X290,BRONX ACADEMY OF HEALTH CAREERS,25,25,
11X415,CHRISTOPHER COLUMBUS HIGH SCHOOL,23,25,
08X332,HOLCOMBE L. RUCKER SCHOOL OF COMMUNITY RESEARCH,18,24,
17K543,"SCIENCE, TECHNOLOGY AND RESEARCH EARLY COLLEGE HIGH SCHOOL AT ERASMUS",24,24,
11X253,BRONX HIGH SCHOOL FOR WRITING AND COMMUNICATION ARTS,18,23,
18K563,IT TAKES A VILLAGE ACADEMY,19,23,
28Q896,"YOUNG WOMEN'S LEADERSHIP SCHOOL, QUEENS",18,23,
10X660,GRACE DODGE CAREER AND TECHNICAL EDUCATION HIGH SCHOOL,18,23,9
14K404,ACADEMY FOR YOUNG WRITERS,23,23,9
02M551,THE URBAN ASSEMBLY NEW YORK HARBOR SCHOOL,19,22,
10X237,"THE MARIE CURIE SCHOOL FOR MEDICINE, NURSING, AND HEALTH PROFESSIONS",22,22,
11X513,NEW WORLD HIGH SCHOOL,22,22,18
12X550,HIGH SCHOOL OF WORLD CULTURES,19,22,8
18K576,VICTORY COLLEGIATE HIGH SCHOOL,11,21,
18K642,URBAN ACTION ACADEMY,21,21,
09X329,DREAMYARD PREPARATORY SCHOOL,21,21,7
02M449,VANGUARD HIGH SCHOOL,20,20,
09X365,ACADEMY FOR LANGUAGE AND TECHNOLOGY,18,20,
10X284,BRONX SCHOOL OF LAW AND FINANCE,15,20,
29Q259,PATHWAYS COLLEGE PREPARATORY SCHOOL: A COLLEGE BOARD SCHOOL,18,20,
12X248,"METROPOLITAN HIGH SCHOOL, THE",20,20,18
07X221,SOUTH BRONX PREPARATORY: A COLLEGE BOARD SCHOOL,17,20,8
13K265,DR. SUSAN S. MCKINNEY SECONDARY SCHOOL OF THE ARTS,13,19,
15K429,BROOKLYN SCHOOL FOR GLOBAL STUDIES,18,19,
19K618,ACADEMY OF INNOVATIVE TECHNOLOGY,19,19,
28Q690,HIGH SCHOOL FOR LAW ENFORCEMENT AND PUBLIC SAFETY,19,19,
32K545,EBC HIGH SCHOOL FOR PUBLIC SERVICE–BUSHWICK,19,19,
03M283,MANHATTAN THEATRE LAB HIGH SCHOOL,18,18,
06M462,HIGH SCHOOL FOR INTERNATIONAL BUSINESS AND FINANCE,17,18,
21K572,EXPEDITIONARY LEARNING SCHOOL FOR COMMUNITY LEADERS,13,18,
09X517,FREDERICK DOUGLASS ACADEMY III SECONDARY SCHOOL,18,18,12
12X388,PAN AMERICAN INTERNATIONAL HIGH SCHOOL AT MONROE,18,18,9
09X525,BRONX LEADERSHIP ACADEMY HIGH SCHOOL,18,18,7
02M460,WASHINGTON IRVING HIGH SCHOOL,17,17,
10X225,THEATRE ARTS PRODUCTION COMPANY SCHOOL,17,17,
07X473,MOTT HAVEN VILLAGE PREPARATORY HIGH SCHOOL,16,16,
09X413,BRONX HIGH SCHOOL FOR MEDICAL SCIENCE,16,16,
29Q248,QUEENS PREPARATORY ACADEMY,16,16,
05M362,"COLUMBIA SECONDARY SCHOOL FOR MATH, SCIENCE, AND ENGINEERING",14,16,15
09X241,"URBAN ASSEMBLY SCHOOL FOR APPLIED MATH AND SCIENCE, THE",16,16,12
01M509,MARTA VALLE HIGH SCHOOL,14,15,
03M860,FREDERICK DOUGLASS ACADEMY II SECONDARY SCHOOL,15,15,
05M469,CHOIR ACADEMY OF HARLEM,15,15,
13K412,"BROOKLYN COMMUNITY HIGH SCHOOL OF COMMUNICATION, ARTS AND MEDIA",15,15,
28Q686,QUEENS METROPOLITAN HIGH SCHOOL,15,15,6
04M680,"HERITAGE SCHOOL, THE",14,14,
11X545,BRONX AEROSPACE HIGH SCHOOL,10,14,
14K071,JUAN MOREL CAMPOS SECONDARY SCHOOL,14,14,12
02M459,MANHATTAN INTERNATIONAL HIGH SCHOOL,13,13,6
01M450,EAST SIDE COMMUNITY SCHOOL,12,12,
04M409,COALITION SCHOOL FOR SOCIAL CHANGE,12,12,
08X295,GATEWAY SCHOOL FOR ENVIRONMENTAL RESEARCH AND TECHNOLOGY,12,12,
27Q260,FREDERICK DOUGLASS ACADEMY VI HIGH SCHOOL,12,12,
02M308,LOWER MANHATTAN ARTS ACADEMY,11,11,
08X432,BRONX BRIDGES HIGH SCHOOL,11,11,
17K537,HIGH SCHOOL FOR YOUTH AND COMMUNITY DEVELOPMENT AT ERASMUS,11,11,
19K409,EAST NEW YORK FAMILY ACADEMY,10,10,
19K504,HIGH SCHOOL FOR CIVIL RIGHTS,8,10,
27Q309,ACADEMY OF MEDICAL TECHNOLOGY: A COLLEGE BOARD SCHOOL,10,10,
12X690,MONROE ACADEMY FOR BUSINESS/LAW,9,9,
15K463,SECONDARY SCHOOL FOR JOURNALISM,9,9,
19K583,MULTICULTURAL HIGH SCHOOL,9,9,
19K510,WORLD ACADEMY FOR TOTAL COMMUNITY HEALTH HIGH SCHOOL,8,8,
28Q350,JAMAICA GATEWAY TO THE SCIENCES,8,8,6
07X527,BRONX LEADERSHIP ACADEMY II HIGH SCHOOL,7,7,
17K531,"SCHOOL FOR HUMAN RIGHTS, THE",7,7,
19K659,CYPRESS HILLS COLLEGIATE PREPARATORY SCHOOL,7,7,
03M299,"HIGH SCHOOL FOR ARTS, IMAGINATION AND INQUIRY",6,6,
18K629,CULTURAL ACADEMY FOR THE ARTS AND SCIENCES,6,6,